,영화댓글
339,"평점 1점대 너무 많아서 별 생각 안하고 가서 봤는데 완전 괜찮음. 사실 그냥 백인애들이 그리는 아시안뽕 영화 정도에 마블 히어로 얘기니 내용도 없을 줄 알았는데 나름 스토리도 있고, 우리는 아시아권 문화라 너무 익숙해서 잘 모르지만 미국애들이 표현하는 것 치고 엄청 괜찮았음. 용에 붉은 색 쓴거나 링에 노란색(황금색)을 쓴거나..무기를 봉, 단검, 링 (나타도 생각남 원래 고전소설이나 그런데 내가 모르는 그런 무기가 있나? 잘 몰라서) 활이나. 중간 중간 대나무들. 그 북경사자춤?의 사자를 표현한 것 등등 (근데 공사에 철근 대신 대나무 댄 건 너무 간 거 아니냐ㅋㅋㅋㅋ) 사람들이 중국영화 라고 욕할만큼(?) 표현하려던 목적 자체는 안촌스럽고 자연스러웠다고도 봄. 문제라면 그냥 그래픽인듯ㅋㅋㅋ그래픽 보니까 제작비가 넉넉해 보이진 않았는데 요즘 코로나라 그런지 영화가 어째 대체적으로 다 그러니..뭐 그거야 봐줄만 하다고 봄. 무협 영화 진짜 싫어했는데; 왜 좋아하는지 알 것 같더라. 구미호도 그렇고 마지막 띄우는 등도 그렇고 아콰피나님 무기는 활이고 그런 거보면 중국을 넘어선 다른 아시안적 요소가 많이 있는데 (사실 위로 따라가면 다 같지만ㅋㅋ) 중국 싫어하면 보면 싫어함 동양 판타지라고 생각하고 보면 주인공들도 섹시하고 멋짐. 영화 시간이 길긴 길음; 모르고 가서 좀 놀램;"
340,남주 우리동네 슈퍼 사장님 닮아서 몰입이 안됨
341,평점 이따구인거 보고 영화관에서 안보고 방에서 봤으면 진짜 열받았겠네 액션 볼거면 닥치고 보러가세요. 예고편보고 어 괜찮은거같은데? 라고 생각한 나 자신에게 감사함을 표합니다.
342,진짜…중뽕이 넘넘 심해요. 도중에 나갈뻔…;;
343,나는 진짜 재밌었다 최고다. 욕하지 마라
344,돈이 궁했나보네ㅋㅋㅋ마블은 이제 끝났어
345,
346,개인적으로 마블의 의리로 봤다. 하지만 액션씬은 마블에서 기대했던 그것보다 좋았고 그래픽역시 중국배우들이 나와서 생각했던중국스러운 영화는 아니었고 나름 멋진고 방대한 영상미를 보여준다.허나 기존의 마블 스토리와는 동떨어진 스토리였다. 타노스가 지구를 지배했어도 전설속에 동물에게졌을것이다. 개인적으로 킬링타임 얘기하는 사람들 이해는 간다만 샹치단일영화로만 본다면어디하나 흠잡을때 없는 멋진영화다. 샹치 대박나세요~ 웡 아져씨 개웃김 ㅋㅋ
347,그래도 돈값은 한다 볼만함
348,인스타에 놀아났다..마블의 역대 실패작…
349,중국한테 돈을 얼마나 받은거냐 ㅡㅡ 진짜 돈아까워 죽겠네.. 디워 마블판
350,영화볼때 핸드폰보는사람 극혐했는데 처음으로 이해됐음
351,네이버 평점 댓글 알바 오지네 다음 평점이 더 신빙성 있다
352,볼만함. 마블영화같음. 다만 CG가 어설픔.. 저것도 힘들게 만든 거겠지만... 그래도 나쁘지않음.
353,아니 얘들아 다같이 족되자고 이렇게 평점 높게주는거야?? 이런 빨간 드래곤 나오는 이딴 영화를?? 왜그래 진짜..
354,네이버후기 진짜 믿을게 못된다무슨 메이드인차이나? 찐메이드인어메리카~ 주연급으로 나온 두명다 엄청 유명한 사람들인데관종놈들 포스터나 대충 보고 댓글다니? 영화를 보기는 하고 리뷰달아라
355,마블 껍데기 쓴 뻔한 중국 영화
356,재밌구만 평점 왜 이래?
357,재미만 있구만ㅋㅋㅋ편견없이 기대없이 사전지식없이 영화관 들어가서 보면 짱재밌게 보고 나올수 있음
358,진짜 재밌는데 ㅋㅋㅋ 뭔 감상평이 이따구임? 보는내내 소름 돋았구맠
359,영상미가 좋고 재미있었습니다.
360,
361,와...진심 돈아깝 혹시나 싶어 통신사 포인트로 본게 신의 한수다
362,이게 재밌다고?? 진심이야???
363,너 대체 무슨 영화야? ... 네가 생각하는 그런 영화가 아니야~
364,기대안하고 봐서였는지~ 너무 재밌었어요~ 액션씬 정말 신나더라구요~
365,
366,"오랫동안 기다려왔던 마블 영화이니만큼 큰 기대가 따르는 건 어쩔 수 없었지만, 그럼에도 불구하고 ""믿고 보는 마블""이라는 칭호가 있듯 평작이었던 것 같다. 만약 마블을 좋아하고 세세한 스토리의 연결을 보고 싶다면 당연히 꼭 봐야할 영화고 마블에 큰 관심이 없다면 그냥 넘어가도 좋을 영화인것 같다. 개인적으로는 주변사람들에게 한 번쯤 볼 만한 영화라고 소개할 것 같다."
367,시진핑 닮은 주인공 정말 밥맛임..중화사상 쪄든 돈많이 들어간 독립영화 수준..
368,주인공들 비쥬얼이 그렇게 끌리지 않아 큰 기대는 안했는데 너무 감동적이고 재밌었어요 액션이 특히 좋고 ㅠ ㅠ
369,액션 좋아하면 진짜 재밌게 볼만함 마블영화 골수팬인데 진짜 재밌게 봤고 이번에 2차 뛰러 갑니다! 영화속에 중국 혹은 홍콩의 문화가 녹아있다고 해서 해서 무작정 거른다고 하거나 억까하는 사람들은..뭐 그만큼 영화를 이해하려는 시도가 없었던 듯 싶네요. 한번쯤 볼만한 영화이고 주인공도 충분히 매력적인 영화입니다. 앞으로 샹치의 활약이 기대되네요!
370,그렇게 전설이 되어버렸다
371,아니 진짜 처음에 양조위랑 여자랑 싸울때 진짜 속으로 저것들 도데체 뭐하냐? 이런 생각이 들었습니다. 싸우려면 제데로 싸우든가 무슨 클로우즈업을 돌아가면서 싸운건지 도무지이해가 안돼네요? 사랑을 표현하려는건 좋은데 이건 좀 손발이 막 오그라드네요.
372,
373,너무 중국 느낌이 강함 스토리가 흘러갈때 불필요한 중국 무술을 강조함
374,스토리는 전형적인 히어로무비라서 볼만하고 초~중반에 나오는 액션씬이 정말 좋음
375,리뷰에 뭐 동북공정이다. 중국풍느껴져서 별로다 하시는데 그건 그냥 인종차별적이고 일방적인 리뷰이구요. 마블이 결국 액션판타지 영화인데그대로 즐기시면 됩니다. CG도 나쁘지않았구요. 우리가 즐겨봤던 엽문 시리즈와 쿵푸허슬 같은경우에도 전혀 이질감없이 즐겼지 않습니까 ?저는 중국을 개인적으로 안좋아하지만 해당 영화는 즐겁게 봤습니다.다만 전개가 매우 빠르기 때문에 집중하지 않으면 줄거리 정리가 안될수도 있습니다.
376,역시 마블은 나를 실망시키지 않는다
377,엽문 + 디워 + 이렐리아
378,중간에 잠와서 졸았음 일반마블이랑 느낌이 다름
379,하.. 영화방금 아니 지금 엔딩 크레딧 올라가는중.그냥 일반영화 좋아하는 사람으로써 써보자면 일단 이거 할거없고 난 개연성없고 그냥 화려하고 오그라들어도 무지성으로 볼수있다하면 보세요. 그거 외엔 마블 딱지 떼면 그냥 중국 영화에요 개연성없어 재미도없어 원래 마블하면 가슴이 웅장해지고 그런거 기대하고가잖아요? 가슴 웅장은 넘어가고 걍 졸려요 하.. 네뭐 이정돈데 봐보세요..
380,진짜 이거 중국영화라는 인식때매 별점테러 하고 댓글알바임 진짜 존나 재밌음 아시아인의 위상을 한단계 올렸다고 생각함
381,중국영화!!! 생각했던 마블영화는 아님
382,속도감 있는 액션에 스케일도 크고 상상치도 못한 전개 충격적.
383,"이게 블랙위도우 보다 더 재밌다. 블랙위도우는 보면서 좀 지루했다.  근데 네이버 평점 보면 블랙이 9점이 넘고 상치는 8점도 안되냐.잘못된 평점.  Google봐도 Rotten Tomatoe, IMDB, Metacritix 다 상치가 블랙위도우 보다 평점 높다. 액션 제대로 재밌었음."
384,아니 충분히 재밌고 중국에서도 상영금지 받아서 오히려좋구만 왜들 까내림??
385,훠훠훠 좋슙니댜 어붼져스를 이겨쥬세요 중국몽ㄷㄷ하노
386,재밌는데 스토리가 좀 엉망임.배우들 연기는 좋음.영상미도
387,중국산 그냥 중국영화 마블은 개뿔
388,진짜 재밌어요
389,생각보다 재밌음ㅇㅇ ost가 좋음
390,샹치에서는 마블 특유의 코미디 소스도 별로였음기대이하 였고 양조위만 기대이상버스 액션신 제외하고 기억나는 액션신도 별로 없었다.
391,재미잇어요!!! 샹치 여동생분 넘 이뻐요
392,
393,음 마블이니깐 보는데  캡마랑 비슷한 것 같은 느낌 몽같기도 하고 개인적으로 주인공은 김씨네 편의점에 나왔던 배우라 익숙하긴한데 뭔가 캐릭터 갭이 크다보니 뭔가 낮설고 솔직히 7점이상은 아닌거 같음
394,평점 테러범들은 약소국의 트라우마를 겪는 분들인가?나는 샹치라는 캐릭터와 양조위 연기에 충분한 매력을 느꼈는데 말야..
395,용이아니라 욕이나옴
396,짱께는 믿거다
397,그냥 이유없이 엄청 재밌음
398,영사미가 예뻣다
399,좋은 작품입니다. 마블의 새시대를 열기에 좋은 것 같아요. 우려보다는 참신한 것 같습니다. 다만 양조위가 더 안 나올  것 같아 아쉽네요.
400,생각했었던 것보다 넘 별로
401,개노잼임 알바 많이풀었나.. 디즈니라 믿고봤는데 걍 개실망함
402,액션이 그냥
403,"쿵푸팬더 때부터 느낀 거지만 이젠 할리우드가 중국보다 무협을 잘 이해하고 잘 만든다. * 혹시 영화가 중국 뽕이나 역사왜곡, 동북공정이 들어간 영화일까봐 걱정하는 분들께 말하자면 그런것과 거리가 멉니다.  애초애 영화 내/외적으로 중국정부가 싫어할 만한 내용이 많아 중국에서 상영금지 되었습니다."
404,이게 마블이냐 ? 그냥 중국영화임 드럽게 재미없네  집에서 돈내고 보는걸 추천??
405,연출하고 영상미는 좋았는데 스토리는 좀 중구난방했어요... 갑자기 죽이며 싸우던 이들이 너무 빠르게 손잡고.. 양조위님 연기는 일품이었습니다~
406,중국풍이 넘 강해서 생각만큼 재밌진 않음 그냥 마블이라서 봄
407,2회차 보러갑니다. 아쉬운부분도 분명있지만 액션과 양조위 하나만으로 커버가능. 쿠키영상 아주 설렘..
408,심형래가 못다이룬 꿈을 케빈 파이기가 해냈다 한국에서 돈벌어 짱개영화를 만들다니아주 실망이야
409,후 양조위 반깐 사랑해 진짜
410,마블보다가 잠든건 처음
411,주인공보다 주인공 아빠가 너무 잘생김용 나올때 너무 중국풍에 소름이 끼쳤음...내가 알던 마블이 아닌거같았음
412,내용완성도가 살짝아쉽고 생각했던것보다 흥미진진한부분도 많았습니다.  7점보다는 8점에 가까운 중국영화!마지막쿠키영상이 더 마블스러웠던 영화!
413,평점보고 설마 싶엇는데 역시나 마블 잼있엇음
414,호불호가 많이 갈리네요 전 '호'였습니다
415,재밌어요나름
416,이게영화냐..진짜 다알바다 보다 나왔음
417,와~~진심 실컷자고 나왔네
418,이거 재밌다는사람  영화볼줄 모르는사람이다 진짜로 마블이 낳은최고의똥
419,아 잘잤따..자고일어나니깐 용이왔다갔따하네요.
420,존잼 샹치 멋져요…..
421,액션빼고는 볼께 없다..
422,아ㅜ 중국영화  한편보고왔다ㅜ CG  개쩔었다ㅋㅋ
423,오랜만에 영화같은 영화를 봤어요~
424,중국 8 마블 2 중국에서 만들었는데 마블이 조금 손가락만 담갔다가 뺀느낌??도중에 보다가 자다깸
425,알레르기만 없다면 빨간맛도 맛있게 소화 가능.
426,다시 시작하는 마블 페이지2. 시작은 무난한듯하다.양동근 생각이 많이 나는 영화였다.떡밥들 때문이 두통이 날 지경이다.다음 10년도 잘 부탁합니다. 마블!!
427,난 재밌었는데  무조건 중국이 들어가면 욕하는 것들 한심함. 중국 상영금지라던데 이게 자본을 노린 수 맞냐? 마션처럼 중국뽕 맞은 영화가 아니잖음;;
428,평점테러 난리났네 보지도 않고 까는놈들 많구나 마블이 그냥 상업영화 답게 잘 뽑았더구만 이정도면 괜찮은편인데 명예 마블세계관 시민들 난리났네
429,스토리가 끔직했어요 90년대 중국영화 수준의 스토리와 연출다만 액션씬은 좋았어요 팔찌를 이용한 액션은 이렇구나 싶을정도
430,영화에서 짱깨냄새난다
431,너무 유치한감이 있었다 기존마블과 다르게 중국느낌도 굉장히 많이나서 낯설었다
432,짱 깨 쌔 끼 야 너거 작품에 1도 관심없다.마블 영화 출연 자격도 없는것이다.그냥 너거 같은것은 내용 해석도 안되는 짝 퉁 어벤져스 같은 또 라 이 작품 제작해라 아니 생각하면 화나네 니들이 문!!자격으로 어 벤 져 스 이름 쳐 쓰노!!어!!
433,고생길에환영한다.. 샹치는 고생길 시무리우는 대기업취칙 샹치 (시무리우) 대기업(마블)에 취직한걸 축하드립니다.
434,중국 스토리는 이해하는데 그걸 끝까지 물고 넘어가는순간 스토리자체가 지겨움;; 액션신은 볼만하나 어느순간 마지막 괴물 나오는순간 정말 중국영화가됨.. 거기서부터 졸았음 ㅡㅡ;
435,마블영화라 기대했는데 이건 그냥 중국영화네요....
436,기대안하고 봤는데 역시 마블영화는 실망시키지 않네요.너무 재미있게 봤습니다. 그리고 양조위 너무 멋있어서 한표!
437,재밌으니 꼭 보시길 특히 ost가 좋음
438,노잼 걍 시진핑 노예 중궈영화 ^^   보다가 눈 찌뿌려져서 걍 잤음 ㅋㅋ 마블도 이젠 망했다~~~~made in chinaaaa ~
439,마블이 워낙 세계관이 넓고 방대해서 페이즈4의 첫 시작을 어떻게 풀어나갈까 하는 궁금증이 있었는데 영화로 잘 표현된듯 CG도 대박이고 보는 내내 눈이 즐거웠던 시간이였다 마블영화는 보고나면 여운이 남는데 이번 샹치는 특히 더 그랬던 것 같음 다음달에 나오는 베놈도 너무 기대된다!!!
440,
441,개인마다 보는 관점은 다를 수 있지만 억까가 심하네요
442,화려한 액션 뒤에 감춰진 빈약한 서사
443,초반버스신처럼 미국배경속에서 풀어나갔으면 좋을텐데 중반부터 너무 중국판타지무협 느낌에다가 끝에 용부터는 아예 뇌절..
444,마블영화중 정말 역대급 최악의 영화 개연성도 없고 어설픈 cg(용나오는거에서 어후..)아버지는 뜬금없이 죽고 최악
445,간만에 보고 나와서 다시 또 볼까 생각난 영화..드라마로 주인공과 주변인의 서사가 더 있어도 좋을것 같고 쿠키에서 또 다른 마블 영화에 나올것 같았는데 진짜 꼭 나왔음 좋겠다^^
446,다소 아쉬운 부분이 있었지만 재밌게 잘 봤네요
447,"눈뽕, 귀뽕 영화"
448,그냥 안봣어야햇다..
449,"마블도 맛이 갔다. 연결고리 뭐하나 없을듯, 샹치 비중 축소가 눈에 훤하다. 그리고 중국 상영 금지? 해도 별 문제 없는데 걍 양조위 싫어 빼애애액 유지한 중국 정부 수준 ㅋㅋㅋ 덕분에 졸작에 돈 안 버려서 오히려 이득이네 부럽노"
450,"호불호가 많이 갈리네요... 전 재밌게 봤습니다. 배경이 중국일뿐이지 중화사상이 들어간 영화도 아니고, 마블의 동양풍 느낌정도"
451,90년대 중국영화느낌
452,역시~ 마블은 마블이다
453,"제대로 된 무협영화다. 최근 중국, 동양 다른 국가의 영화와 비교했을 때 몇 단계 우위에 설 정도로 액션, 서사 등 많은 점이 뛰어났다. 무로써 협을 실행한다는 설정을 잘 실행했으며 앞선 블위와 달리 가족애에 대해 잘 표현했다. 아쉬운 것은 이 영화는 단독 영화가 아니라 앞으로 나올 다른 mcu영화와 연관이 있다는 것이다. 4페이즈부터 세계관은 확장하는 데 각각의 소재들이 잘 버무려 지지 않는 다는 것이다. 1000년동안 권력을 위해 수많은 사람들을 죽이고 전쟁을 벌여왔는데 중국의 작은 지역 하나를 차지하고 있고, 이용한 무기는 샹치 때문에 이제서야 정체가 드러난다? 다른 아쉬운 부분은 트레보와 케이티 특히 케이티는 분량은 많지만 굳이 나왔어야 했을까? 차후에 더 많은 활약을 할 수 있겠지만 그가 샹치의 여정에 끼여드는 부분은 너무 억지스러운 면이 있다. 전체적으론 재미있게 잘 봤다. 중국자본이나 문화 올려치기라는 의견도 있지만 무협영화는 예전부터 인기있는 장르였고 마블 역시 많은 캐릭이 존재했으니 이런 영화가 나온 것을 꼭 부정적으로 볼 순 없다 생각한다. 영화 본 분들은 알겠지만 시무 리우보다는 양조위!!! 진짜 연기 대박이네. 장멍얼 섹시함."
454,개연성 갖다 버린 거 같고 액션씬 두 번 정도 좋았던 거 같음
455,양조위 웬우 보고싶어서 또 봐야 겟다
456,액션 개쩐다 ㅠㅠ 재미씁니다 밤새고 영화보러가서 졸까봐 걱정했는데 잠이고뭐고 집중해서 그냥 시간 순삭이네여
457,중뽕으로 풀 무장한 영화 현재(서구권)을 악으로 부터 지키는 건 중국이고. 악은 서양 용이고. 동양 용은 중국인이랑 힙합쳐서 악을 막으며 살아감 ㅋㅋㅋㅋ
458,무한도전 최코디 마블단독주연 !
459,마블팬으로서 중국 이런거 다 제외시키고 그냥 역시 마블은 마블이라는 생각이 들었고 정말 재밋게 잘 봤는데 관람객 평점이 왜 이러죠 .. ㅜㅜ 영화가 아무리 상업의 목적이라해도 정말 힐링 그대로입니다 .. 판타지물을 좋아하는 저로써는 여전히 재밋는 마블
460,짱개 in 마블 주인공 시진핑
461,액션은 볼만함...근데 보다가 졸음 뻔한 스토리...
462,마블영화보면서 잠잔건 처음. 완전중국풍
463,마블 아니었으면 안봤을 영화
464,아콰피나는 한국계 혼혈 배우에 양조위는 중국인 아니고 예로부터 유구하게 공개적으로 홍콩의 민주화운동을 지지하다가 보이콧당했고 양자경은 중국인 아니고 중공과 유착관계인 미얀마 군부를 비판하며 민주화운동을 지지표명했습니다 중국니니 뭐니 무작정 욕하는 것도 그만 좀..~ 중국에서는 이 영화 상영 하지도 못해요
465,재미는 확연히 있었으나코시국 반중 감정 + 사회적 눈치보기까지 감안해딱 7점짜리 영화 ㅋㅋ화려한 액션 가슴이 뜨거워지는 느낌이 있었으나개중 무협영화 같은 씬에서 마냥 환호하기에는 괜시리 주변 눈치보게되는
466,양조위 양조위 양조위 양조위
467,중국은 믿고 거르는게 맞지요~
468,솔직히 말하면 재밌다.
469,마블도 중국스탈은 극복하지 못하네 ㅜ
470,아니..중국 인이 주인공이고 중국문화 중국무술이 주된 배경이 되는 스토리 인데 뭔 중국풍 이니 made in cihna 거리면서 까노 ㅂㅅ들이 ㅋㅋ한국인이 주인공 마블 영화 나와도 그 ㅈㄹ떨래?? ㅂㅅ들 머리가 나쁘면 영화를 보질 말던가
471,역시 마블은 배신하지 않는다
472,분명 아쉬운 부분도 있긴했으나 그냥 딱 마블영화입니다. 볼만해요.갠적으론 무협격투 액션 부분이 좀 더 많았으면 좋았을 것 같네요.다른 캐릭터들 1편 영화 보다는 한수 위 입니다.앞으로가 기대됩니다.
473,텐링즈를 이용한 액션 하나는 쾌감지수 만점
474,무협 좋아합니다요런 장르 선호 ㅋ볼거리가 가득한 영화
475,영화보다 처음으로 잤어요.. 마블꺼라 봤는데 이건 뭐 영웅물도 아니고 그냥 중국 무협영화같음.. ㅠㅠ 영화보면서 좋았던건 노래뿐이었고요.. 용 나오는 순간부터 진짜 100% 중국영화느낌. 사실 무협영화를 싫어하는 편도 아니었지만 마블에서 나온거라 봤는데 속은느낌이랄까요? 그냥 돈아까웠어요 전
476,양조위가 울아빠였으면... 넘나 스윗 로맨틱함 물론 액션도 말모말모~ 텐링즈 무기도 신박하다 마치 터키아이스크림... 잡아야지~? 못잡겟지~? 과연 샹치는 텐링즈를 잡았을까요? 고거슨 극장에서 확인하시라!
477,용이랑 괴물이 싸우는 장면에서 b급 중국영화 느낌이 나서 아쉬웠음
478,초반부터 중반까지 휘몰아치는 액션이 대박임 이래저래 다 재밌는건 아니였지만 그래도 전반적으로 재밌게 봤음
479,평점 낮아서 당황...ㅎ 너무 재밌게 봄 ㅎㅎㅎ 양조위 멋있어 !!
480,착짱죽짱 짱깨욕 존나 해대면서 짱깨영화 빨아주는 국민성 클라스 야이 개돼지들아 한가지만 해라 욕하려면 철저하게 불매하고 불매 못할 것 같으면 애초에 욕하지를 말아 니네나 짱깨나 똑같이 역겨움
481,용이 나오는 순간 내 눈을 의심했지만..그래도 액션이 볼만했다.
482,어설픈 와호장룡 훙내내기+디워+기도라
483,짱개냄새 너무역함 양조위만 나왔으면...
484,킬링타임용 그 이상 그 이하도 아님. 중국자본이라 한국뿐만 아니라 전세계적으로 명작이라고 홍보에 여념이 없다.  중국 우상만드는 금강 뭐시기 영화도 나온다더니... 영화계도 중국몽에 빠져그나
485,코로나 터지고 간만에 잼있는 영화 봤네요~
486,반중정서 때문에 까이지만 사실 홍콩영화
487,마블 영화 기대 하지마라그냥 중국 무협 영화다앵앵거리믄서 주먹날린다어벤져스 그립다
488,의무감에 보긴했지만 막판에는 히어로영환지 괴수영환지 아리까리하더라구요
489,마블이 마블했다 크으으으으
490,여윽시마아브을기모링
491,불편한거 1도없었고 한국계 혼혈 아콰피나님 감초연기랑 만다린이 재미졌음 시무리우랑 장멍 액션도 좋았고 양조위... 진짜 양조위 개미침ㅜ 앞으로 이 아시아계 첫 어벤져의 활약이 더 기대됨!!
492,영화관서 자다가 깨서 또 자긴  처음.. ㅠ
493,중뽕거르고 재밌음 애초에 중국개봉불가인데 시러하는 이유를 모르겠네
494,양조위랑 주인공엄마랑 싸우는 첫 전투씬보자마자 나가고싶었습니다.. 양조위한테 왜 최코디얼굴이나왔는지도 이해가안가고;
495,
496,양조위라는 배우의 카리스마와 매력에 밀려서 주연 배우들은 아무런 매력이 느껴지지 않음. 양조위를 제외하고 매우 평면적인 캐릭터들과 일관성 없는 스토리라인. 억지로 쑤셔넣은 페미니즘 서사까지 캡틴 마블 급으로 별로였음
497,중간에 졸음 양조위 나오고 마블이면 보는거다
498,지금까지 본 마블영화 중 제일 재미없다
499,중국나온다고 생각없이 별점테러하는데 부끄러운줄 알아야지 중화사상들어있는것도 아니고 제작진들도 중국에 반감가져서 나온 사람들인데 그냥 광신도마냥 중국이라고 까기만 하니..  남자평점은 테러때문에 거르시고 여자평점이 진짜 평점이라고 보시면 되겠습니다
